{
  "$schema": "https://json-schema.org/draft/2020-12/schema",
  "$id": "https://tartaluga.github.io/schema/project.schema.json",
  "title": "Project",
  "description": "Один проект хаба. Файл projects/<slug>.json, schemaVersion 1 или 2 (ADR-009). Незнакомые поля разрешены и должны сохраняться всеми, кто пишет файл (ADR-003).",
  "type": "object",
  "required": ["schemaVersion", "slug", "title", "status", "createdAt", "updatedAt"],
  "properties": {
    "schemaVersion": { "$ref": "defs.schema.json#/$defs/schemaVersion" },
    "slug": { "$ref": "defs.schema.json#/$defs/slug" },
    "title": { "type": "string", "$ref": "defs.schema.json#/$defs/nonEmptyText", "maxLength": 120 },
    "description": {
      "description": "Описание проекта. Можно Markdown.",
      "type": "string"
    },
    "stack": {
      "description": "Технологии и инструменты, по порядку важности.",
      "type": "array",
      "items": { "$ref": "defs.schema.json#/$defs/nonEmptyText" }
    },
    "tags": {
      "description": "Id тегов из settings.json. Незнакомый id показывается серым тегом, а не считается ошибкой.",
      "type": "array",
      "items": { "type": "string", "minLength": 1 },
      "uniqueItems": true
    },
    "status": {
      "description": "idea — идея, active — в работе, paused — пауза, done — готово, archived — архив. Список закрытый: от статуса зависит логика экранов, поэтому новый статус — это новая schemaVersion.",
      "enum": ["idea", "active", "paused", "done", "archived"]
    },
    "nextStep": {
      "description": "Следующий шаг одной строкой. Пустая строка или отсутствие поля — шаг не задан.",
      "type": "string",
      "maxLength": 200
    },
    "pinned": {
      "description": "Закреплён: на экране «Проекты» стоит первым при любой сортировке и в любом фильтре. Необязательное; отсутствие или false — не закреплён. Хаб при откреплении убирает поле.",
      "type": "boolean"
    },
    "cover": {
      "description": "Путь к обложке в репо данных (covers/<slug>.webp или .jpg). null или отсутствие — генеративная заглушка.",
      "type": ["string", "null"],
      "pattern": "^covers/[a-z0-9-]+\\.(webp|jpg)$"
    },
    "banner": {
      "description": "Путь к шапке карточки (banners/<slug>.webp или .jpg), полоса 5:2. null или отсутствие — шапки нет (ADR-016).",
      "type": ["string", "null"],
      "pattern": "^banners/[a-z0-9-]+\\.(webp|jpg)$"
    },
    "links": {
      "type": "array",
      "items": { "$ref": "#/$defs/link" }
    },
    "milestones": {
      "description": "Вехи по порядку. Прогресс вехи считается по задачам с её milestoneId.",
      "type": "array",
      "items": { "$ref": "#/$defs/milestone" }
    },
    "tasks": {
      "type": "array",
      "items": { "$ref": "#/$defs/task" }
    },
    "log": {
      "description": "Лента записей. Пишущие добавляют новые записи в конец; читающие не полагаются на порядок в файле и сортируют по at сами.",
      "type": "array",
      "items": { "$ref": "#/$defs/logEntry" }
    },
    "createdAt": { "$ref": "defs.schema.json#/$defs/dateTime" },
    "updatedAt": {
      "description": "Время последней правки. Любой пишущий (приложение, скилл) обновляет его.",
      "$ref": "defs.schema.json#/$defs/dateTime"
    },
    "doneAt": {
      "description": "v2. Когда проект перешёл в «готово». Допустимо только при status = done. Хаб ставит при переходе в «готово» и удаляет при уходе из него; у проектов, закрытых до v2, поля нет (ADR-009).",
      "$ref": "defs.schema.json#/$defs/dateTime"
    },
    "fromIdea": {
      "description": "v2. Идея, из которой сделан проект («Сделать проектом»). Есть только у таких проектов, не меняется (ADR-009).",
      "type": "object",
      "required": ["ideaId", "text", "createdAt"],
      "properties": {
        "ideaId": { "$ref": "defs.schema.json#/$defs/ulid" },
        "text": { "$ref": "defs.schema.json#/$defs/nonEmptyText" },
        "createdAt": { "$ref": "defs.schema.json#/$defs/dateTime" }
      }
    }
  },
  "allOf": [
    {
      "if": { "type": "object", "required": ["doneAt"] },
      "then": { "type": "object", "properties": { "status": { "const": "done" } } }
    }
  ],
  "$defs": {
    "link": {
      "type": "object",
      "required": ["id", "kind", "value"],
      "properties": {
        "id": { "$ref": "defs.schema.json#/$defs/ulid" },
        "kind": {
          "description": "Известные виды: folder — путь к папке на ПК; repo — GitHub-репо в виде owner/name; site — опубликованный сайт; local — локальный URL (localhost); doc — документ; other — прочее. Список открытый: незнакомый вид показывается как обычная ссылка, чтобы новые виды не ломали старые версии приложения.",
          "type": "string",
          "pattern": "^[a-z][a-z0-9-]*$"
        },
        "value": {
          "description": "folder: путь (C:\\\\Users\\\\...); repo: owner/name; остальные: URL.",
          "$ref": "defs.schema.json#/$defs/nonEmptyText"
        },
        "label": { "type": "string", "maxLength": 80 }
      },
      "allOf": [
        {
          "if": { "properties": { "kind": { "const": "repo" } } },
          "then": { "properties": { "value": { "type": "string", "pattern": "^[A-Za-z0-9-]+/[A-Za-z0-9._-]+$" } } }
        },
        {
          "if": { "properties": { "kind": { "enum": ["site", "local", "doc"] } } },
          "then": { "properties": { "value": { "type": "string", "pattern": "^https?://" } } }
        }
      ]
    },
    "milestone": {
      "type": "object",
      "required": ["id", "title"],
      "properties": {
        "id": { "$ref": "defs.schema.json#/$defs/ulid" },
        "title": { "type": "string", "$ref": "defs.schema.json#/$defs/nonEmptyText", "maxLength": 120 },
        "due": { "$ref": "defs.schema.json#/$defs/date" }
      },
      "not": {
        "description": "У вехи первого срока (originalDue) не бывает (ADR-009).",
        "type": "object",
        "required": ["originalDue"]
      }
    },
    "task": {
      "type": "object",
      "required": ["id", "title", "done"],
      "properties": {
        "id": { "$ref": "defs.schema.json#/$defs/ulid" },
        "title": { "type": "string", "$ref": "defs.schema.json#/$defs/nonEmptyText", "maxLength": 200 },
        "done": { "type": "boolean" },
        "due": { "$ref": "defs.schema.json#/$defs/date" },
        "milestoneId": {
          "description": "Id вехи, к которой относится задача. Если вехи с таким id нет, задача считается без вехи.",
          "$ref": "defs.schema.json#/$defs/ulid"
        },
        "doneAt": { "$ref": "defs.schema.json#/$defs/dateTime" },
        "originalDue": {
          "description": "v2. Первый срок задачи для статистики «в срок / перенесено». Допустимо только при due. Хаб копирует due при первом задании срока и дальше не меняет; если поля нет, первым сроком считается due (ADR-009).",
          "$ref": "defs.schema.json#/$defs/date"
        },
        "description": {
          "description": "Подробности задачи, Markdown без сырого HTML (ADR-016).",
          "type": "string",
          "maxLength": 10000
        },
        "inProgress": {
          "description": "Задача в работе. Значимо только при done = false: при done = true не показывается, хаб при записи убирает (ADR-016).",
          "const": true
        },
        "links": {
          "type": "array",
          "items": { "$ref": "#/$defs/link" }
        },
        "cancelled": {
          "description": "Задача отменена. Значимо только при done = true; при done = false хаб при записи убирает (ADR-016).",
          "const": true
        },
        "comments": {
          "type": "array",
          "items": { "$ref": "#/$defs/comment" }
        }
      },
      "dependentRequired": { "originalDue": ["due"] }
    },
    "comment": {
      "type": "object",
      "required": ["id", "at", "text"],
      "properties": {
        "id": { "$ref": "defs.schema.json#/$defs/ulid" },
        "at": { "$ref": "defs.schema.json#/$defs/dateTime" },
        "text": { "type": "string", "$ref": "defs.schema.json#/$defs/nonEmptyText", "maxLength": 2000 },
        "editedAt": { "$ref": "defs.schema.json#/$defs/dateTime" },
        "author": {
          "description": "Кто написал. Отсутствие — владелец. Известные: claude. Список открытый: незнакомый автор показывается как «другой».",
          "type": "string",
          "pattern": "^[a-z][a-z0-9-]*$"
        }
      }
    },
    "logEntry": {
      "type": "object",
      "required": ["id", "at", "kind", "text"],
      "properties": {
        "id": { "$ref": "defs.schema.json#/$defs/ulid" },
        "at": { "$ref": "defs.schema.json#/$defs/dateTime" },
        "kind": {
          "description": "Известные виды: done — что сделано; decision — решение; thought — мысль; task — смена статуса или срока задачи (ADR-016). Список открытый: незнакомый вид показывается как «запись».",
          "type": "string",
          "pattern": "^[a-z][a-z0-9-]*$"
        },
        "text": { "$ref": "defs.schema.json#/$defs/nonEmptyText" },
        "taskId": {
          "description": "Задача этого проекта, к которой относится запись (kind = task, ADR-016). Только ссылка для перехода: задачи нет — запись показывается без ссылки.",
          "type": "string"
        }
      }
    }
  }
}
