{
  "schemaVersion": 2,
  "slug": "portfolio",
  "title": "Портфолио",
  "status": "done",
  "doneAt": "2026-09-02T18:20:00+03:00",
  "milestones": [
    { "id": "01K5TQ0000000000000000B001", "title": "Запуск", "due": "2026-09-01" }
  ],
  "tasks": [
    { "id": "01K5TQ0000000000000000C001", "title": "Вёрстка", "done": true, "due": "2026-08-25", "originalDue": "2026-08-20", "doneAt": "2026-08-24T12:00:00+03:00" },
    { "id": "01K5TQ0000000000000000C002", "title": "Без срока", "done": true }
  ],
  "createdAt": "2026-08-01T10:00:00+03:00",
  "updatedAt": "2026-09-02T18:20:00+03:00"
}
