{
  "schemaVersion": 2,
  "slug": "bot-raspisaniya",
  "title": "Бот расписания",
  "status": "active",
  "fromIdea": { "ideaId": "01K5TQ0000000000000000E001", "text": "Бот для расписания\nпарсить сайт вуза", "createdAt": "2026-09-23T01:00:00+03:00" },
  "tasks": [
    { "id": "01K5TQ0000000000000000C001", "title": "Парсер", "done": false, "due": "2026-10-05", "originalDue": "2026-10-05" },
    { "id": "01K5TQ0000000000000000C002", "title": "Срок без первого срока (скилл)", "done": false, "due": "2026-10-10" }
  ],
  "createdAt": "2026-09-24T09:00:00+03:00",
  "updatedAt": "2026-09-24T09:00:00+03:00"
}
